{
  "source_id": "ccs-climate-central-july-warming",
  "title": "July 4th: The Hottest Month Is Getting Hotter After 250 Years of Climate Change",
  "original_url": "https://www.climatecentral.org/climate-matters/250-years-of-climate-change",
  "canonical_url": "https://www.climatecentral.org/climate-matters/250-years-of-climate-change",
  "stable_identifier": null,
  "authors_or_organisation": [
    "Climate Central"
  ],
  "publication_date": "2026-07-01",
  "retrieval_timestamp": "2026-08-17T12:00:00-07:00",
  "source_environment": "blogs-and-commentary",
  "source_type": "research-analysis",
  "source_role": "research-commentary",
  "publisher_or_platform": "Climate Central",
  "source_domain": "www.climatecentral.org",
  "language": "en",
  "geographies": [
    "global"
  ],
  "evidence_basis": [
    "official-webpage-body"
  ],
  "evidence_limitations": "The analysis is outside the 30-day pilot window and is geographically limited to US cities.",
  "content_access_status": "substantive",
  "content_hash": "37fd3e7226afd06619d576f80f801c1ea9cddb579dbd3c0c60d6a38752b5f467",
  "discovery": {
    "adapter": "captured-web-fixture",
    "query_id": "cc-fixture-where-new-evidence-matters",
    "query_version": "current-conversations-v2.0.0",
    "run_id": "thematic-reframe-mixed-source-captured"
  },
  "ai_annotation": {
    "model": "captured-deterministic-annotation",
    "prompt_version": "current-conversations-classification-v1-fixture",
    "summary": "Climate Central presents city-level July temperature trends, downloadable data and methodology for more than 240 US cities.",
    "reason_for_relevance": "The item demonstrates how analysis, local data and communication products are assembled for urban evidence use."
  },
  "risk_flags": [],
  "correction_status": "none",
  "availability_status": "available",
  "review": {
    "status": "not-reviewed",
    "reviewer": null,
    "reviewed_date": null,
    "edits": []
  },
  "lab_affiliated": false,
  "mdpi_excluded": false,
  "captured_fixture": true
}
